{
  "$schema": "https://json-schema.org/draft/2020-12/schema",
  "schemaVersion": "module-params-schema.v1",
  "moduleType": "drawer_low",
  "title": "Drawer Low Params",
  "type": "object",
  "properties": {
    "type": {
      "type": "string"
    },
    "width": {
      "type": "number"
    },
    "height": {
      "type": "number"
    },
    "depth": {
      "type": "number"
    },
    "boardThickness": {
      "type": "number"
    },
    "backThickness": {
      "type": "number"
    },
    "frontThicknessMm": {
      "type": "number"
    },
    "drawerCount": {
      "type": "number"
    },
    "drawerFrontHeights": {
      "type": "array",
      "items": {
        "type": "number"
      }
    },
    "drawerBoxSideHeight": {
      "type": "number"
    },
    "drawerBoxThickness": {
      "type": "number"
    },
    "drawerBackReserveMm": {
      "type": "number"
    },
    "sideGap": {
      "type": "number"
    },
    "topGap": {
      "type": "number"
    },
    "bottomGap": {
      "type": "number"
    },
    "frontGap": {
      "type": "number"
    },
    "plinthHeight": {
      "type": "number"
    },
    "worktopThicknessMm": {
      "type": "number"
    },
    "handleType": {
      "type": "string"
    },
    "handleLengthMm": {
      "type": "number"
    },
    "handleProjectionMm": {
      "type": "number"
    },
    "handleSizeMm": {
      "type": "number"
    },
    "bodyMaterial": {
      "type": "string"
    },
    "frontMaterial": {
      "type": "string"
    },
    "wallMounted": {
      "type": "boolean"
    }
  },
  "required": [
    "backThickness",
    "boardThickness",
    "bodyMaterial",
    "bottomGap",
    "depth",
    "drawerBackReserveMm",
    "drawerBoxSideHeight",
    "drawerBoxThickness",
    "drawerCount",
    "drawerFrontHeights",
    "frontGap",
    "frontMaterial",
    "frontThicknessMm",
    "handleLengthMm",
    "handleProjectionMm",
    "handleSizeMm",
    "handleType",
    "height",
    "plinthHeight",
    "sideGap",
    "topGap",
    "type",
    "wallMounted",
    "width",
    "worktopThicknessMm"
  ],
  "additionalProperties": true
}